{
  "$schema": "../../schema/sdpatch-v1.schema.json",
  "formatVersion": 1,
  "id": "starfront-ipad-landscape",
  "name": "Starfront HD landscape presentation",
  "kind": "compatibility",
  "status": "experimental",
  "defaultEnabled": true,
  "priority": 100,
  "target": {
    "bundleId": "com.gameloft.StarFrontiPad",
    "bundleVersions": ["1.0.0"],
    "executableSha256": [
      "67a78b70ab85c4ad91a3ab46fc73068b0abe7febb7e8eb268388e2c395e2970a"
    ]
  },
  "actions": {
    "presentation": {
      "correctLandscapeAutorotationLayout": true,
      "disableTouchRotation": false
    }
  }
}
