{
  "formatVersion": 1,
  "id": "gateway-e2e-selftest-20260829",
  "name": "Gateway E2E self-test",
  "kind": "compatibility",
  "status": "experimental",
  "defaultEnabled": false,
  "priority": 100,
  "target": {
    "bundleId": "org.superduper.gatewaytest",
    "bundleVersions": [
      "1.0"
    ],
    "executableSha256": [
      "cccccccccccccccccccccccccccccccccccccccccccccccccccccccccccccccc"
    ],
    "allowLegacyWeakMatch": false
  },
  "actions": {
    "presentation": {
      "presentFlipX": false
    }
  }
}
