{
  "$schema": "../../schema/sdpatch-v1.schema.json",
  "formatVersion": 1,
  "id": "controller-com-ea-candcra-row-44d5d049",
  "name": "Геймпад · курсор, нажатие и drag — Red Alert",
  "kind": "input",
  "status": "experimental",
  "defaultEnabled": false,
  "priority": 100,
  "target": {
    "bundleId": "com.ea.candcra.row",
    "bundleVersions": [
      "1.1.0"
    ],
    "executableSha256": [
      "44d5d049a7524662418083f5c545576ea050ff4149c6aeac4b1406f80109d88f"
    ]
  },
  "actions": {
    "input": {
      "cursorMode": "relative",
      "cursorClickButton": "A"
    }
  }
}
