{
  "$schema": "../../schema/sdpatch-v1.schema.json",
  "formatVersion": 1,
  "id": "spider-man-103-orientation",
  "name": "Spider-Man 1.0.3 — исправление перевёрнутого изображения",
  "kind": "compatibility",
  "status": "experimental",
  "defaultEnabled": true,
  "priority": 100,
  "target": {
    "bundleId": "com.gameloft.AmazingSpiderMan",
    "bundleVersions": ["1.0.3"],
    "executableSha256": [
      "38832d6b998ca9ffa9f76fab9e1f312ea58316ed45e6aa380da0b5856044ce4f"
    ]
  },
  "actions": {
    "presentation": {
      "presentRotate180": true
    }
  }
}
